{
  "$schema": "https://json-schema.org/draft/2020-12/schema",
  "$id": "https://open-content-engine.example/schemas/inputs/operator-command.schema.json",
  "title": "Operator Command",
  "description": "Structured operator command that initiates a content run. Validated fail-closed before any queue creation, artifact write, or seat dispatch (spec §6.1): unknown fields or invalid enum values reject the whole command. An operator command enters by exactly three documented routes — an engine CLI verb, a parsed ops-channel message, or a schema-conformant task record under $CONTENT_HOME/ledger/tasks/.",
  "x-stability": "stable",
  "type": "object",
  "additionalProperties": false,
  "required": [
    "command_family",
    "brand",
    "platform",
    "format"
  ],
  "properties": {
    "command_family": {
      "description": "The RUN_* command family. Determines which fields are required and how the run is routed (spec §6.1 v1 baseline families).",
      "type": "string",
      "enum": [
        "RUN_SLOT",
        "RUN_BATCH",
        "RUN_CAMPAIGN",
        "RUN_TREND_MANUAL"
      ]
    },
    "brand": {
      "description": "Brand id this command runs for (matches a brands/<brand-id>/brand.json id). Account class (operator vs brand) lives on the brand record, not here.",
      "type": "string",
      "minLength": 1
    },
    "platform": {
      "description": "Target platform descriptor id (e.g. an entry in the platform-descriptor registry).",
      "type": "string",
      "minLength": 1
    },
    "format": {
      "description": "Content format within the platform (e.g. single-post, thread, single-post-image, carousel, short-clip). The valid set is platform-descriptor-defined; this schema enforces presence and type only.",
      "type": "string",
      "minLength": 1
    },
    "mode": {
      "description": "Publish posture for this run. Defaults to SAFE when omitted, resolving the SAFE-vs-LIVE contradiction fail-closed (RD-16f). SAFE = artifacts only; LIVE_PREVIEW = real approval cards, no publish; LIVE = full pipeline with draft-only handoff.",
      "type": "string",
      "enum": [
        "SAFE",
        "LIVE_PREVIEW",
        "LIVE"
      ],
      "default": "SAFE"
    },
    "routing_class": {
      "description": "Workflow classification. Routing is by classification, not by command family: TEXT_HEAVY = the written argument is the main artifact; VISUAL_HEAVY = the asset is the main artifact (spec §6.1, §8.1).",
      "type": "string",
      "enum": [
        "TEXT_HEAVY",
        "VISUAL_HEAVY"
      ]
    },
    "slot_ref": {
      "description": "Reference to the calendar slot this run produces for (a calendar slot_id). Required for RUN_SLOT and RUN_TREND_MANUAL.",
      "type": "string",
      "minLength": 1
    },
    "campaign_ref": {
      "description": "Reference to the campaign whose claimed slots this command produces for. Required for RUN_CAMPAIGN.",
      "type": "string",
      "minLength": 1
    },
    "batch_date": {
      "description": "The calendar day whose slot set this command produces (the unit morning-kickoff emits). Required for RUN_BATCH. Local calendar date.",
      "type": "string",
      "format": "date"
    },
    "trend_report_ref": {
      "description": "Reference to the manually submitted trend report (trend-report.schema.json) feeding a trend-reserved slot. Required for RUN_TREND_MANUAL.",
      "type": "string",
      "minLength": 1
    },
    "pillar": {
      "description": "Content pillar / strategic lane for the run (freeform plain text).",
      "type": "string"
    },
    "theme": {
      "description": "Theme or topic for the run (freeform plain text).",
      "type": "string"
    },
    "content_id": {
      "description": "Explicit content id. Optional; auto-generated when omitted.",
      "type": "string",
      "minLength": 1
    },
    "media_source": {
      "description": "Optional media sourcing hint for visual/video runs: a CONTENT_HOME-relative path, a source hint, or a capture directive.",
      "type": "string"
    },
    "max": {
      "description": "Upper bound on the number of slot runs a batch command dispatches (the staggered/bounded kickoff control). Applies to RUN_BATCH and RUN_CAMPAIGN.",
      "type": "integer",
      "minimum": 1
    },
    "notes": {
      "description": "Optional freeform operator notes carried into the run.",
      "type": "string"
    }
  },
  "allOf": [
    {
      "if": {
        "properties": {
          "command_family": {
            "const": "RUN_SLOT"
          }
        }
      },
      "then": {
        "required": [
          "slot_ref"
        ]
      }
    },
    {
      "if": {
        "properties": {
          "command_family": {
            "const": "RUN_BATCH"
          }
        }
      },
      "then": {
        "required": [
          "batch_date"
        ]
      }
    },
    {
      "if": {
        "properties": {
          "command_family": {
            "const": "RUN_CAMPAIGN"
          }
        }
      },
      "then": {
        "required": [
          "campaign_ref"
        ]
      }
    },
    {
      "if": {
        "properties": {
          "command_family": {
            "const": "RUN_TREND_MANUAL"
          }
        }
      },
      "then": {
        "required": [
          "slot_ref",
          "trend_report_ref"
        ]
      }
    }
  ]
}
